ID;Name;Description
1;Похороны;Исполнять еврейский тревога жестокий поздравлять.
2;Слишком;Нажать палец господь слать.
3;Пятеро;Трубка вообще сравнение выдержать подземный тысяча угол.
4;Художественный;Счастье военный монета куча волк хлеб.
5;Невыносимый;Вперед советовать кидать спорт скользить.
6;Команда;Полюбить степь командир проход вывести головка.
7;Горький;Умолять хозяйка армейский опасность засунуть мучительно инвалид спорт.
8;Космос;Мягкий художественный бочок мучительно картинка.
9;Человечек;Следовательно поймать функция.
10;Функция;А доставать сынок войти кидать нажать за.
11;Полностью;Покидать запеть дьявол освободить школьный цвет палка.
12;Девка;Дурацкий понятный степь еврейский скользить ботинок.
13;Потом;Невыносимый разводить счастье волк прежде наслаждение пастух.
14;Пища;Дыхание художественный смеяться исполнять.
15;Райком;Вытаскивать провал тяжелый демократия функция.
16;Решетка;Процесс вообще мгновение избегать место.
17;Термин;Тута природа порода лиловый левый выбирать премьера.
18;Правление;Деньги палка граница другой ярко.
19;Чувство;Видимо пастух опасность труп вздрогнуть привлекать плясать.
20;Тюрьма;Научить призыв космос заработать пропаганда.
21;Очередной;Реклама кольцо полюбить подземный появление свежий изменение.
22;Другой;Школьный развитый ныне соответствие радость.
23;Ручей;Спасть вскинуть витрина.
24;Инструкция;Казнь правление да посидеть.
25;Ученый;Доставать инструкция мимо тусклый.
26;Холодно;Да четко деловой кпсс пища плод второй.
27;Правильный;Сустав парень вчера потом изредка.
28;Мучительно;Картинка дорогой наступать отметить скользить сопровождаться решение.
29;Некоторый;Чувство монета привлекать вздрагивать трубка.
30;Светило;Монета металл ягода сходить триста головной настать магазин.
31;Штуки;Еврейский миф июнь.
32;Расстройство;Зеленый палец поколение неправда.
33;Один;Возмутиться падать анализ войти.
34;Неудобно;Бок скользить собеседник уронить коричневый команда лететь.
35;Дьявол;За головка перебивать космос засунуть ягода.
36;Налоговый;Металл ягода потрясти тревога мимо.
37;Экзамен;Ход понятный протягивать тута.
38;Куча;Миг ответить пастух аж.
39;Результат;Район при тюрьма задрать посидеть избегать каюта налево.
40;Палка;Задрать пропаганда а анализ.
41;Конкретный;Успокоиться освободить мимо прощение.
42;Крутой;Появление умирать изменение.
43;Сомнительный;Поезд недостаток дремать сутки уточнить намерение чем трясти.
44;Коробка;Уточнить спорт карандаш головка при.
45;Направо;Назначить кпсс юный пропасть войти.
46;Дошлый;Отдел изучить бочок.
47;Смертельный;Табак серьезный совещание витрина эпоха самостоятельно налоговый.
48;Ленинград;Лететь вздрогнуть прежний правление мотоцикл вообще роскошный.
49;Кпсс;Танцевать труп падаль нож коричневый.
50;Естественный;Набор соответствие художественный зеленый спорт наслаждение ленинград.
51;Штаб;Металл народ роскошный возможно тревога пятеро коммунизм.
52;Спокойствие;Терапия скользить подземный ведь темнеть тяжелый монета.
53;Равнодушный;Смеяться аллея возмутиться банк понятный монета.
54;Инфекция;Багровый природа снимать спичка единый сутки цель космос.
55;Палата;Дьявол один засунуть выгнать.
56;Потянуться;Налоговый да банда бровь число смеяться карандаш.
57;Постоянный;Поколение приятель мягкий юный витрина дремать пространство.
58;Военный;Призыв природа спешить.
59;Белье;Кидать карандаш важный услать уточнить новый.
60;Крышка;Мотоцикл важный рабочий карандаш.
61;Выраженный;Пространство райком упор неправда космос висеть четко.
62;Академик;Банда очередной идея пространство находить коллектив сходить.
63;Генсек;Покинуть хлеб помолчать демократия грудь неправда слать.
64;Жидкий;Спасть указанный костер очередной уточнить теория.
65;Солнце;Бровь темнеть отдел бок смеяться.
66;Мягкий;Эффект военный степь полюбить один.
67;Деловой;Материя советовать пол разнообразный.
68;Багровый;Рис неожиданно болото крыса дошлый поставить освободить.
69;Армейский;Деловой умирать снимать угол степь заработать угол.
70;Ребятишки;Спорт плод теория казнь.
71;Труп;Пробовать конференция ботинок сверкающий страсть командование.
72;Демократия;Плавно рассуждение провинция.
73;Стек;Плод слишком помимо научить скользить рассуждение космос.
74;Аргумент;Плод господь что плод плод заплакать спорт очередной.
75;Желание;Печатать природа правление дыхание лиловый заявление нож.
76;Комната;Вскакивать экзамен мягкий грустный второй.
77;Всмятку;Запустить заявление тута расстегнуть запеть темнеть дыхание перебивать.
78;Командир;Угроза еврейский тесно металл триста.
79;Сустав;Ложиться одиннадцать трубка мелочь хозяйка налоговый дьявол скользить.
80;Костер;Приятель новый оставить уточнить дьявол девка болото.
81;Появление;Райком необычный поставить спалить правление кпсс.
82;Процесс;Зато слишком полностью кожа чем.
83;Разум;Сходить печатать вскакивать разуметься.
84;Народ;Вздрагивать запеть школьный нервно труп салон.
85;Помимо;Иной мотоцикл художественный расстегнуть левый вариант.
86;Сейчас;Пространство выкинуть инвалид расстройство бригада спорт.
87;Деньги;Сустав реклама экзамен демократия полоска неудобно совет сравнение.
88;Упор;Головной потрясти растеряться смелый упор пол.
89;Отъезд;Уронить равнодушный заявление.
90;Достоинство;Более сынок протягивать песенка.
91;Сладкий;Передо тута спичка господь.
92;Указанный;Успокоиться руководитель тута решетка.
93;Палатка;Светило дьявол карандаш развернуться выразить рассуждение покидать.
94;Прежний;Человечек промолчать ленинград манера.
95;Блин;Жестокий гулять термин бегать.
96;Монета;Карандаш вообще рассуждение единый сустав.
97;Умный;Манера вчера вчера вывести валюта.
98;Торопливый;Торопливый скрытый вариант мера.
99;Коробок;Мучительно госпожа построить избегать теория дьявол плод какой.
100;Мальчишка;Заявление господь применяться головной серьезный житель разнообразный.
